{"spec":"bijux-dag/v0.1","meta":{"name":"diamond","owners":[],"tags":[]},"inputs":{},"nondeterminism_allowed":false,"nodes":[{"id":"a","kind":"const","inputs":[],"outputs":[{"name":"out","path":"a/out"}],"params":{"value":1}},{"id":"b","kind":"const","inputs":["in"],"outputs":[{"name":"out","path":"b/out"}],"params":{"value":2}},{"id":"c","kind":"const","inputs":["in"],"outputs":[{"name":"out","path":"c/out"}],"params":{"value":3}},{"id":"d","kind":"const","inputs":["in1","in2"],"outputs":[{"name":"out","path":"d/out"}],"params":{"value":4}}],"edges":[{"from":{"node_id":"a","port":"out"},"to":{"node_id":"b","port":"in"}},{"from":{"node_id":"a","port":"out"},"to":{"node_id":"c","port":"in"}},{"from":{"node_id":"b","port":"out"},"to":{"node_id":"d","port":"in1"}},{"from":{"node_id":"c","port":"out"},"to":{"node_id":"d","port":"in2"}}]}
