{"spec":"bijux-dag/v0.1","meta":{"name":"isolated-groups","owners":[],"tags":[]},"inputs":{},"nondeterminism_allowed":false,"nodes":[{"id":"g1_a","kind":"const","inputs":[],"outputs":[{"name":"out","path":"g1_a/out"}],"params":{"value":1},"group":"g1"},{"id":"g1_b","kind":"const","inputs":["in"],"outputs":[{"name":"out","path":"g1_b/out"}],"params":{"value":2},"group":"g1"},{"id":"g2_a","kind":"const","inputs":[],"outputs":[{"name":"out","path":"g2_a/out"}],"params":{"value":3},"group":"g2"}],"edges":[{"from":{"node_id":"g1_a","port":"out"},"to":{"node_id":"g1_b","port":"in"}}]}
