{"spec":"bijux-dag/v0.1","meta":{"name":"scheduler-diamond-fanout","owners":[],"tags":["scheduler","diamond","fanout"]},"inputs":{},"nondeterminism_allowed":false,"nodes":[{"id":"root","kind":"const","inputs":[],"outputs":[{"name":"out","path":"root/out"}],"params":{"value":1}},{"id":"a","kind":"const","inputs":["in"],"outputs":[{"name":"out","path":"a/out"}],"params":{"value":2}},{"id":"b","kind":"const","inputs":["in"],"outputs":[{"name":"out","path":"b/out"}],"params":{"value":3}},{"id":"join","kind":"const","inputs":["left","right"],"outputs":[{"name":"out","path":"join/out"}],"params":{"value":4}},{"id":"tail1","kind":"const","inputs":["in"],"outputs":[{"name":"out","path":"tail1/out"}],"params":{"value":5}},{"id":"tail2","kind":"const","inputs":["in"],"outputs":[{"name":"out","path":"tail2/out"}],"params":{"value":6}}],"edges":[{"from":{"node_id":"root","port":"out"},"to":{"node_id":"a","port":"in"}},{"from":{"node_id":"root","port":"out"},"to":{"node_id":"b","port":"in"}},{"from":{"node_id":"a","port":"out"},"to":{"node_id":"join","port":"left"}},{"from":{"node_id":"b","port":"out"},"to":{"node_id":"join","port":"right"}},{"from":{"node_id":"join","port":"out"},"to":{"node_id":"tail1","port":"in"}},{"from":{"node_id":"join","port":"out"},"to":{"node_id":"tail2","port":"in"}}]}
