{
  "spec": "bijux-dag/v0.1",
  "meta": {"name": "conflicting-retry-timeout", "owners": [], "tags": []},
  "nodes": [
    {
      "id": "nondet_retry_timeout",
      "kind": "shell",
      "inputs": [],
      "outputs": [{"name": "out", "path": "nondet/out"}],
      "params": {"argv": ["echo", "x"]},
      "effects": ["filesystem", "network"],
      "retry": {"max_attempts": 3, "backoff_ms": 50},
      "timeout_ms": 10
    }
  ],
  "edges": []
}
