{"spec":"bijux-dag/v0.1","meta":{"name":"scheduler-parallel-64","owners":[],"tags":["scheduler","parallel"]},"inputs":{},"nondeterminism_allowed":false,"nodes":[{"id":"p01","kind":"const","inputs":[],"outputs":[{"name":"out","path":"p01/out"}],"params":{"value":1}},{"id":"p02","kind":"const","inputs":[],"outputs":[{"name":"out","path":"p02/out"}],"params":{"value":2}},{"id":"p03","kind":"const","inputs":[],"outputs":[{"name":"out","path":"p03/out"}],"params":{"value":3}},{"id":"p04","kind":"const","inputs":[],"outputs":[{"name":"out","path":"p04/out"}],"params":{"value":4}},{"id":"p05","kind":"const","inputs":[],"outputs":[{"name":"out","path":"p05/out"}],"params":{"value":5}},{"id":"p06","kind":"const","inputs":[],"outputs":[{"name":"out","path":"p06/out"}],"params":{"value":6}},{"id":"p07","kind":"const","inputs":[],"outputs":[{"name":"out","path":"p07/out"}],"params":{"value":7}},{"id":"p08","kind":"const","inputs":[],"outputs":[{"name":"out","path":"p08/out"}],"params":{"value":8}}],"edges":[]}
