{"spec":"bijux-dag/v0.1","meta":{"name":"imported-bundle-replay","owners":[],"tags":[]},"inputs":{"imported_bundle_id":"bundle-123","seed":7},"nondeterminism_allowed":false,"nodes":[{"id":"hydrate_import","kind":"const","inputs":[],"outputs":[{"name":"out","path":"hydrate_import/out"}],"params":{"value":"bundle-123"}},{"id":"replay_check","kind":"const","inputs":["in"],"outputs":[{"name":"out","path":"replay_check/out"}],"params":{"value":"verify"}}],"edges":[{"from":{"node_id":"hydrate_import","port":"out"},"to":{"node_id":"replay_check","port":"in"}}]}
